{
  "request_id": "req-1",
  "conversation_id": "conv-1",
  "session_id": "session-1",
  "device_id": "device-1",
  "user_context": {
    "user_ref": "user-1",
    "locale": "fa-IR"
  },
  "message": "Open the example form",
  "observation": {
    "observation_version": 3,
    "app_version": 1,
    "profile_version": 1,
    "screen": "home",
    "modal": null,
    "loading": false,
    "fields": [],
    "draft": null,
    "supported_operations": [
      "observe",
      "navigate"
    ]
  }
}
